{
  "schemaVersion": "1.0",
  "runId": "20261003t120000z-adr004-degradation-candidate-a-r1",
  "run": {
    "gitSha": "aaaaaaaaaaaaaaaaaaaaaaaaaaaaaaaaaaaaaaaa",
    "gitDirty": false,
    "gitRef": "main",
    "startedUtc": "2026-10-03T12:00:00.000Z",
    "endedUtc": "2026-10-03T12:30:00.000Z",
    "operator": "ci:test",
    "tier": "T2",
    "suite": "adr004/degradation",
    "candidate": "candidate-a",
    "repetition": {
      "index": 1,
      "of": 3
    },
    "cacheState": "warm",
    "tool": {
      "name": "opportunity-bench",
      "version": "1.0.0"
    }
  },
  "environment": {
    "schemaVersion": "1.0",
    "capturedUtc": "2026-10-03T11:59:00.000Z",
    "capturedBy": {
      "name": "opportunity-bench",
      "version": "1.0.0"
    },
    "profile": "developer-regression",
    "hosts": [
      {
        "role": "all-in-one",
        "cpu": {
          "model": "Example CPU",
          "architecture": "x86_64",
          "logicalCores": 16,
          "physicalCores": 8,
          "sockets": 1
        },
        "memory": {
          "totalBytes": 68719476736
        },
        "disks": [
          {
            "name": "nvme0n1",
            "type": "nvme",
            "rotational": false,
            "sizeBytes": 1099511627776,
            "backs": [
              "/var/lib/docker"
            ]
          }
        ],
        "os": {
          "kernel": "6.8.0"
        },
        "containerRuntime": {
          "name": "docker",
          "version": "29.0.0"
        },
        "platform": {
          "kind": "bare-metal"
        }
      }
    ],
    "software": {
      "versionsEnv": {
        "path": "versions.env",
        "sha256": "b2d6f8e28e4f6b1bfb7ec5f3dbfb7d6b5247f7f295b079ca78817574d52e7a69",
        "values": {
          "AZURITE": "3.37.0",
          "CYCLONEDX_NPM": "6.0.1",
          "DOTNET_SDK": "10.0.100",
          "GITLEAKS": "8.30.1",
          "GITLEAKS_SHA256": "551f6fc83ea457d62a0d98237cbad105af8d557003051f41f3e7ca7b3f2470eb",
          "NODE": "24",
          "OPENSEARCH": "3.2.0",
          "OPENSEARCH_DIGEST": "sha256:23297b8d8545e129dd58c254ed08d786dc552410ba772983ad2af31048d2f04b",
          "POSTGRES": "17",
          "POSTGRES_DIGEST": "sha256:d74eeac9a635390a49bc21bd49fccd973de707e2a53a76ac49b552b8712ec46f",
          "RABBITMQ": "4.1",
          "RABBITMQ_DIGEST": "sha256:b799868f08431981001c959b04d169bff614b39c816af9c5c7acc3e031fbfc55",
          "SEAWEEDFS": "4.48",
          "SEAWEEDFS_DIGEST": "sha256:4e61d15fd35994cb1e43e1e553dff106794841fd9a99ade2fc8c8bfce4d7872d",
          "TOXIPROXY": "2.12.0",
          "TOXIPROXY_DIGEST": "sha256:9378ed52a28bc50edc1350f936f518f31fa95f0d15917d6eb40b8e376d1a214e",
          "TRIVY": "0.75.0",
          "TRIVY_SHA256": "c6e65abddb348e25f10549df887045629cf28cc72453cd1c63acb717316b3f3f"
        }
      },
      "images": [
        {
          "key": "POSTGRES",
          "repository": "postgres",
          "tag": "17",
          "digest": "sha256:d74eeac9a635390a49bc21bd49fccd973de707e2a53a76ac49b552b8712ec46f"
        },
        {
          "key": "OPENSEARCH",
          "repository": "opensearchproject/opensearch",
          "tag": "3.2.0",
          "digest": "sha256:23297b8d8545e129dd58c254ed08d786dc552410ba772983ad2af31048d2f04b"
        },
        {
          "key": "RABBITMQ",
          "repository": "rabbitmq",
          "tag": "4.1",
          "digest": "sha256:b799868f08431981001c959b04d169bff614b39c816af9c5c7acc3e031fbfc55"
        },
        {
          "key": "SEAWEEDFS",
          "repository": "chrislusf/seaweedfs",
          "tag": "4.48",
          "digest": "sha256:4e61d15fd35994cb1e43e1e553dff106794841fd9a99ade2fc8c8bfce4d7872d"
        },
        {
          "key": "TOXIPROXY",
          "repository": "ghcr.io/shopify/toxiproxy",
          "tag": "2.12.0",
          "digest": "sha256:9378ed52a28bc50edc1350f936f518f31fa95f0d15917d6eb40b8e376d1a214e"
        }
      ]
    },
    "containers": [
      {
        "name": "opportunity-dev-postgres-1",
        "service": "postgres",
        "composeProject": "opportunity-dev",
        "image": {
          "reference": "postgres:17@sha256:d74eeac9a635390a49bc21bd49fccd973de707e2a53a76ac49b552b8712ec46f",
          "id": "sha256:1111111111111111111111111111111111111111111111111111111111111111"
        },
        "pin": {
          "key": "POSTGRES",
          "expectedDigest": "sha256:d74eeac9a635390a49bc21bd49fccd973de707e2a53a76ac49b552b8712ec46f",
          "matches": true
        }
      },
      {
        "name": "opportunity-dev-opensearch-1",
        "service": "opensearch",
        "composeProject": "opportunity-dev",
        "image": {
          "reference": "opensearchproject/opensearch:3.2.0@sha256:23297b8d8545e129dd58c254ed08d786dc552410ba772983ad2af31048d2f04b",
          "id": "sha256:2222222222222222222222222222222222222222222222222222222222222222"
        },
        "pin": {
          "key": "OPENSEARCH",
          "expectedDigest": "sha256:23297b8d8545e129dd58c254ed08d786dc552410ba772983ad2af31048d2f04b",
          "matches": true
        },
        "environment": {
          "OPENSEARCH_JAVA_OPTS": "-Xms1g -Xmx1g"
        }
      }
    ],
    "postgres": [
      {
        "name": "primary",
        "serverVersion": "17.6",
        "role": "primary",
        "settings": {
          "fsync": {
            "value": "on"
          },
          "shared_buffers": {
            "value": "16384",
            "unit": "8kB"
          }
        },
        "durability": {
          "fsync": "on",
          "synchronousCommit": "on",
          "fullPageWrites": "on",
          "walLevel": "replica",
          "walSyncMethod": "fdatasync",
          "synchronousStandbyNames": ""
        }
      }
    ],
    "opensearch": {
      "clusterName": "opportunity-dev",
      "version": "3.2.0",
      "nodes": [
        {
          "name": "node-1",
          "roles": [
            "data",
            "ingest",
            "cluster_manager"
          ],
          "jvm": {
            "version": "24",
            "heapMaxBytes": 1073741824,
            "inputArguments": [
              "-Xms1g",
              "-Xmx1g"
            ]
          }
        }
      ],
      "clusterSettings": {
        "persistent": {},
        "transient": {}
      },
      "indices": [
        {
          "name": "docs-shared-000001",
          "primaryShards": 1,
          "replicas": 0,
          "refreshInterval": "1s",
          "translogDurability": "request"
        }
      ]
    },
    "rabbitmq": {
      "version": "4.1.4",
      "queues": [
        {
          "name": "index.chunks",
          "vhost": "/",
          "type": "quorum",
          "durable": true
        }
      ]
    },
    "objectStore": {
      "provider": "FileSystem",
      "implementation": "filesystem (named volume)"
    },
    "workers": [
      {
        "type": "all",
        "instances": 1
      }
    ],
    "durability": {
      "mode": "production",
      "deviations": []
    }
  },
  "corpus": {
    "manifestFile": "corpus-manifest.json",
    "manifestSha256": "2fe12019070e4b1b885498206c21804c7af714f5647c5e45dce5283b4fcf0ad9",
    "generator": {
      "name": "Opportunity.DataGenerator",
      "version": "1.0.0"
    },
    "seed": 20261003,
    "profileName": "enterprise-reference",
    "profileHash": "sha256:cf85df3011187d547f692695b04fd7f47426f85b509f322377bd56397d1af95b",
    "documentCount": 300,
    "loadPath": "fast-path"
  },
  "workload": {
    "name": "search-mix",
    "version": "0.1.0",
    "taxonomyVersion": "1",
    "querySeed": 42,
    "model": "open",
    "scripts": [
      {
        "path": "workload/search-mix.js",
        "sha256": "e5584a5ae5e827c96fd9431362b913e17ebd75e1174b44102cc45e1a0551b29a"
      }
    ],
    "workloadSha256": "2540c0cdc688c8c7472c00c268fdcec0bc8002447acbf7369ebae6c7c7fa1377",
    "mix": {
      "simple": 0.6,
      "boolean": 0.3,
      "proximity-wildcard": 0.1
    },
    "offeredRate": {
      "queriesPerSecond": 50,
      "bulkDocsPerSecond": 2000
    }
  },
  "gates": {
    "path": "gates.yaml",
    "sha256": "fcd4b16b8f62538b1164cfeb192b30caecea60a9ab2a55f07e116e92a0446637",
    "gatesVersion": "0.1.0",
    "status": "draft"
  },
  "scenarios": [
    {
      "id": "idle",
      "role": "idle-baseline",
      "startedUtc": "2026-10-03T12:00:00.000Z",
      "endedUtc": "2026-10-03T12:09:00.000Z",
      "warmupSeconds": 60,
      "drainSeconds": 30,
      "validity": {
        "valid": true,
        "droppedIterationsRatio": 0.001,
        "loadGeneratorCpuMaxPercent": 41,
        "reasons": []
      },
      "queryClasses": [
        {
          "name": "simple",
          "gated": true,
          "requests": 2000,
          "errors": 0,
          "latency": {
            "unit": "us",
            "count": 2000,
            "min": 21952,
            "p50": 40159,
            "p90": 63967,
            "p95": 68351,
            "p99": 71999,
            "p999": 72767,
            "max": 72895,
            "mean": 42471.908,
            "hdr": {
              "encoding": "hdrhistogram-v2-compressed-base64",
              "lowestTrackableValue": 1,
              "highestTrackableValue": 3600000000,
              "significantDigits": 3,